"data_dodania","autor","komentarz","ocena","reputacja_autora","kategoria","platforma"
"2023-10-01","Jan Kowalski","Gra w szachy jest całkiem intuicyjna, ale brakuje mi bardziej zaawansowanych funkcji analitycznych po zakończeniu partii.",4,5,"interfejs_rozgrywka","web"
"2023-10-03","Ewa Nowak","Pomimo kilku rund w pokera, nadal mam problem z zapamiętaniem układów kart, przydałaby się lepsza pomoc w grze.",3,4,"poradniki_support","mobile_android"
"2023-10-05","Marek Wiśniewski","Częste błędy przy ładowaniu gry Monopoly są frustrujące. Utrata połączenia psuje całą zabawę.",2,3,"problemy_techniczne","mobile_ios"
"2023-10-07","Ania Kwiatkowska","Interfejs w ruletce jest czytelny, ale nie mogę się przyzwyczaić do zmiany kolorów stołu.",3,4,"interfejs_rozgrywka","web"
"2023-10-10","Tomasz Zielinski","Support odpowiada standardowymi frazami, nie pomagając w rozwiązaniu mojego problemu z logowaniem.",2,2,"poradniki_support","mobile_android"
"2023-10-12","Karolina Lewandowska","Czy tylko mnie irytują te ciągłe aktualizacje w grze w Scrabble? Czasem nie można nawet zacząć rozgrywki.",2,3,"problemy_techniczne","mobile_ios"
"2023-10-15","Piotr Szymański","Black Jack trochę za wolno się wczytuje. Poza tym interfejs jest ok.",3,4,"interfejs_rozgrywka","web"
"2023-10-18","Monika Kozłowska","Poradnik do gry w warcaby jest niekompletny. Brakowało mi informacji o podstawowych strategiach.",3,4,"poradniki_support","mobile_android"
"2023-10-20","anonim","Na iOSie sloty się zacinają. Robi się to coraz częstsze i zaczyna być nie do przyjęcia.",1,3,"problemy_techniczne","mobile_ios"
"2023-10-23","Grzegorz Pawłowski","Kółko i krzyżyk zbyt proste, brak wyzwań, interfejs bez zarzutu.",3,3,"interfejs_rozgrywka","web"
"2023-10-25","Dorota Majewska","Zgłosiłam problem z nieprawidłowym naliczeniem punktów w Scrabble, ale nie dostałam jeszcze odpowiedzi.",2,3,"poradniki_support","mobile_android"
"2023-10-28","Rafał Kamiński","Problemy z połączeniem podczas gry w pokera na Androidzie to już norma. Kiedy to naprawicie?",1,2,"problemy_techniczne","mobile_android"
"2023-11-01","Alicja Zalewska","Monopoly fajnie się gra, ale opcje personalizacji pionków mogłyby być bardziej rozbudowane.",4,5,"interfejs_rozgrywka","web"
"2023-11-03","anonim","Instrukcja do ruletki mogłaby być bardziej szczegółowa. Nie każdy jest ekspertem.",3,1,"poradniki_support","mobile_ios"
"2023-11-05","Bartosz Jabłoński","Gra w sloty na iOS działa coraz gorzej. Brak optymalizacji?",1,2,"problemy_techniczne","mobile_ios"
"2023-11-08","Katarzyna Dąbrowska","Opcje dostosowania avatara są ograniczone. Chciałabym więcej możliwości personalizacji.",3,4,"interfejs_rozgrywka","web"
"2023-11-10","anonim","Dlaczego nie ma porządnych tutoriali do gier planszowych? Musiałem szukać zasad na zewnętrznych stronach.",2,1,"poradniki_support","mobile_android"
"2023-11-12","Michał Nowicki","Gra w szachy przez przeglądarkę często gubi ruchy. To niepoważne.",1,3,"problemy_techniczne","web"
"2023-11-15","anonim","Cieszę się, że jest ranking w grze w warcaby, ale jego interfejs jest nieintuicyjny.",3,2,"interfejs_rozgrywka","mobile_android"
"2023-11-18","Beata Jankowska","Obsługa klienta nie pomogła mi w odzyskaniu utraconych żetonów. Rozczarowana.",2,3,"poradniki_support","mobile_ios"
"2023-11-20","Krzysztof Krawczyk","Znowu serwer nie działa podczas mojej najlepszej rundy w pokerze. Tracę przez to czas i pieniądze.",1,2,"problemy_techniczne","web"
"2023-11-22","Magdalena Wójcik","Chciałabym zmieniać tło w grze w Scrabble, a nie tylko standardowe opcje.",3,4,"interfejs_rozgrywka","mobile_android"
"2023-11-25","Damian Malinowski","Gdzie znaleźć pełną listę zasad do Monopoly? Pomoc oferuje zbyt ogólne informacje.",2,3,"poradniki_support","web"
"2023-11-28","anonim","Rozłączenia podczas gry w szachy to koszmar. Nie mogłem nawet dokończyć partii.",1,1,"problemy_techniczne","mobile_ios"
"2023-12-01","Patrycja Sobczak","Wprowadzenie zmian w interfejsie podczas rozgrywki w ruletkę bez wcześniejszego uprzedzenia to zła decyzja.",2,4,"interfejs_rozgrywka","web"
"2023-12-03","Łukasz Mazur","Zabrakło mi w poradnikach wyjaśnienia strategii dla zaawansowanych graczy w pokera.",2,4,"poradniki_support","mobile_android"
"2023-10-01","Patryk Nowak","Interfejs black jacka wymaga poprawy, ciężko się połapać w zakładach.",4,4,"interfejs_rozgrywka","web"
"2023-10-03","Ewa Kowalska","Mógłby być lepszy tutorial do pokera, szczególnie dla nowych graczy.",3,4,"poradniki_support","mobile_android"
"2023-10-05","anonim","Czuje się zignorowany przez support, mój problem z płatnościami nie został szybko rozwiązany.",2,3,"problemy_techniczne","mobile_ios"
"2023-10-08","Marek Jankowski","Brakuje możliwości personalizacji avatara w ruletce.",3,5,"interfejs_rozgrywka","web"
"2023-10-10","Agnieszka Białek","Sloty są ok, ale przez brak możliwości dostosowania stawek czuje się ograniczona.",3,4,"interfejs_rozgrywka","mobile_android"
"2023-10-12","anonim","Gdzie znajdę aktualne zasady gry w Monopoly? Te na stronie są niepełne.",3,3,"poradniki_support","web"
"2023-10-16","Krzysztof Krawczyk","Po ostatniej aktualizacji scrabble często się zawiesza. Frustrujące.",2,4,"problemy_techniczne","mobile_ios"
"2023-10-18","Sylwia Marecka","Nie mogę zrozumieć, jak działają bonusy w grze. Brak wyjaśnień.",3,5,"interfejs_rozgrywka","web"
"2023-10-20","Tomasz Zieliński","Warcaby online to świetna zabawa, ale poziom komputera jest za niski nawet na najwyższym poziomie trudności.",3,4,"interfejs_rozgrywka","mobile_android"
"2023-10-22","anonim","Na iOSie gra się przyjemnie, ale czasami ekran dotykowy nie reaguje. To psuje doświadczenie.",2,3,"problemy_techniczne","mobile_ios"
"2023-10-25","Dorota Misztal","Brak możliwości wyboru tła stołu w pokerze to duży minus. Chciałabym coś więcej niż standardowy zielony stół.",3,4,"interfejs_rozgrywka","web"
"2023-10-28","anonim","Nie mogę znaleźć informacji jak dokładnie wygląda ranking w szachach. Poprawcie to.",3,3,"poradniki_support","mobile_android"
"2023-11-01","Mateusz Górnik","Zbyt często pojawiają się błędy serwera podczas gry w Monopoly, przez co tracę postępy.",2,4,"problemy_techniczne","web"
"2023-11-03","Katarzyna Nowak","Chciałabym móc ustawić własne reguły w Scrabble, a nie tylko grac na standardowych.",3,5,"interfejs_rozgrywka","mobile_ios"
"2023-11-06","Grzegorz Lis","Gra w kółko i krzyżyk powinna mieć opcję gry na większej planszy, obecne rozmiary szybko nudzą.",3,4,"interfejs_rozgrywka","mobile_android"
"2023-11-09","anonim","Gdzie jest pomoc techniczna? Czekam na odpowiedź od kilku dni w sprawie zawieszania się ruletki.",1,2,"problemy_techniczne","web"
"2023-11-12","Izabela Marek","Zabrakło mi opcji zmiany kolorów kart w blackjacku. W innych grach to standard.",2,4,"interfejs_rozgrywka","mobile_ios"
"2023-11-15","Karol Wojtowicz","Na Androidzie często wychodzę z gry przypadkowymi gestami. Zróbcie zabezpieczenie przed tym.",2,5,"problemy_techniczne","mobile_android"
"2023-11-18","Justyna Kwiatkowska","Czemu nie mogę zobaczyć statystyk moich gier w pokerze? To podstawowa funkcja.",2,4,"interfejs_rozgrywka","web"
"2023-11-21","anonim","Instrukcje gry w szachy są przestarzałe, proszę o aktualizację.",2,3,"poradniki_support","mobile_ios"
"2023-11-24","Michał Rozwadowski","Gry planszowe dobrze się prezentują, ale nie można ustawić poziomu trudności przeciwnika komputerowego.",2,3,"interfejs_rozgrywka","web"
"2023-11-27","anonim","Pomoc techniczna nie odpowiada, a ja mam problem z logowaniem się na konto.",1,2,"problemy_techniczne","mobile_android"
"2023-12-01","Paulina Gajos","Brak synchronizacji postępów między urządzeniami to duży minus, szczególnie jak się gra na telefonie i komputerze.",2,4,"problemy_techniczne","mobile_ios"
"2023-12-04","anonim","Interfejs w wersji mobilnej jest nieintuicyjny, trudno się odnaleźć między zakładkami.",1,2,"interfejs_rozgrywka","mobile_android"
"2023-12-07","Igor Wiśniewski","Tutorial do warcabów jest niewystarczający, a gra z komputerem jest zbyt łatwa nawet dla początkujących.",1,3,"poradniki_support","web"